{
  "$schema": "catalog-index-schema.json",
  "version": "2.6.0",
  "profiles": {
    "shapes": "profiles/shapes.json",
    "platforms": "profiles/platforms.json",
    "frameworks": "profiles/frameworks.json",
    "concerns": "profiles/concerns.json",
    "audiences": "profiles/audiences.json"
  },
  "tiers": {
    "spine": {
      "order": 10
    },
    "diligence": {
      "order": 20
    },
    "portfolio": {
      "order": 30
    }
  },
  "groups": [
    "root",
    "product",
    "architecture",
    "flows",
    "engineering",
    "operations",
    "reference",
    "security",
    "contributing",
    "records",
    "portfolio",
    "agent-context"
  ],
  "capabilities": [
    "code_graph",
    "flow_graph",
    "manifests",
    "git_history"
  ],
  "cue_hints": [
    {
      "cue": "shared-noun",
      "examples": [
        "model",
        "agent",
        "pipeline",
        "platform",
        "policy",
        "worker",
        "card",
        "ledger"
      ],
      "note": "Weak path/token cues; agent must ground meaning in repo evidence before preferring any aspect."
    }
  ],
  "document_types": [
    {
      "id": "architecture_index",
      "tier": "spine",
      "path": "docs/architecture/README.md",
      "record": "documents/architecture/architecture_index.json"
    },
    {
      "id": "arch_high_level",
      "tier": "spine",
      "path": "docs/architecture/high-level.md",
      "record": "documents/architecture/arch_high_level.json"
    },
    {
      "id": "arch_low_level",
      "tier": "diligence",
      "path": "docs/architecture/low-level.md",
      "record": "documents/architecture/arch_low_level.json"
    },
    {
      "id": "architecture_constraints",
      "tier": "diligence",
      "path": "docs/architecture/constraints.md",
      "record": "documents/architecture/architecture_constraints.json"
    },
    {
      "id": "dependencies",
      "tier": "diligence",
      "path": "docs/architecture/dependencies.md",
      "record": "documents/architecture/dependencies.json"
    },
    {
      "id": "tech_debt",
      "tier": "diligence",
      "path": "docs/architecture/tech-debt.md",
      "record": "documents/architecture/tech_debt.json"
    },
    {
      "id": "concepts_index",
      "tier": "diligence",
      "path": "docs/architecture/concepts/README.md",
      "record": "documents/architecture/concepts_index.json"
    },
    {
      "id": "app_lifecycle",
      "tier": "spine",
      "path": "docs/architecture/application-lifecycle.md",
      "record": "documents/architecture/app_lifecycle.json"
    },
    {
      "id": "concept",
      "tier": "diligence",
      "path": "docs/architecture/concepts/{slug}.md",
      "record": "documents/architecture/concept.json"
    },
    {
      "id": "data_flow",
      "tier": "spine",
      "path": "docs/architecture/data-flow.md",
      "record": "documents/architecture/data_flow.json"
    },
    {
      "id": "ai_integration",
      "tier": "spine",
      "path": "docs/architecture/ai-integration.md",
      "record": "documents/architecture/ai_integration.json"
    },
    {
      "id": "data_contracts_index",
      "tier": "spine",
      "path": "docs/architecture/contracts/README.md",
      "record": "documents/architecture/data_contracts_index.json"
    },
    {
      "id": "persistence",
      "tier": "spine",
      "path": "docs/architecture/persistence.md",
      "record": "documents/architecture/persistence.json"
    },
    {
      "id": "system_overview",
      "tier": "spine",
      "path": "docs/architecture/system-overview.md",
      "record": "documents/architecture/system_overview.json"
    },
    {
      "id": "app_ui_state",
      "tier": "spine",
      "path": "docs/architecture/ui-and-state.md",
      "record": "documents/architecture/app_ui_state.json"
    },
    {
      "id": "contract_system",
      "tier": "spine",
      "path": "docs/architecture/contract-system.md",
      "record": "documents/architecture/contract_system.json"
    },
    {
      "id": "dataset",
      "tier": "spine",
      "path": "docs/architecture/contracts/{slug}.md",
      "record": "documents/architecture/dataset.json"
    },
    {
      "id": "infra_environments",
      "tier": "spine",
      "path": "docs/architecture/environments.md",
      "record": "documents/architecture/infra_environments.json"
    },
    {
      "id": "gameplay_systems",
      "tier": "spine",
      "path": "docs/architecture/gameplay-systems.md",
      "record": "documents/architecture/gameplay_systems.json"
    },
    {
      "id": "hardware_map",
      "tier": "spine",
      "path": "docs/architecture/hardware-map.md",
      "record": "documents/architecture/hardware_map.json"
    },
    {
      "id": "host_integration",
      "tier": "spine",
      "path": "docs/architecture/host-integration.md",
      "record": "documents/architecture/host_integration.json"
    },
    {
      "id": "model_lifecycle",
      "tier": "spine",
      "path": "docs/architecture/model-lifecycle.md",
      "record": "documents/architecture/model_lifecycle.json"
    },
    {
      "id": "platform_integration",
      "tier": "spine",
      "path": "docs/architecture/platform-integration.md",
      "record": "documents/architecture/platform_integration.json"
    },
    {
      "id": "web_rendering",
      "tier": "spine",
      "path": "docs/architecture/rendering.md",
      "record": "documents/architecture/web_rendering.json"
    },
    {
      "id": "worker_triggers",
      "tier": "spine",
      "path": "docs/architecture/triggers-and-jobs.md",
      "record": "documents/architecture/worker_triggers.json"
    },
    {
      "id": "game_assets",
      "tier": "spine",
      "path": "docs/architecture/assets-and-scenes.md",
      "record": "documents/architecture/game_assets.json"
    },
    {
      "id": "firmware_lifecycle",
      "tier": "spine",
      "path": "docs/architecture/firmware-lifecycle.md",
      "record": "documents/architecture/firmware_lifecycle.json"
    },
    {
      "id": "infra_network",
      "tier": "spine",
      "path": "docs/architecture/network.md",
      "record": "documents/architecture/infra_network.json"
    },
    {
      "id": "pwa_installation",
      "tier": "spine",
      "path": "docs/architecture/offline-and-installation.md",
      "record": "documents/architecture/pwa_installation.json"
    },
    {
      "id": "web_state",
      "tier": "spine",
      "path": "docs/architecture/state.md",
      "record": "documents/architecture/web_state.json"
    },
    {
      "id": "product_index",
      "tier": "spine",
      "path": "docs/product/README.md",
      "record": "documents/product/product_index.json"
    },
    {
      "id": "web_components",
      "tier": "spine",
      "path": "docs/architecture/ui-components.md",
      "record": "documents/architecture/web_components.json"
    },
    {
      "id": "product_overview",
      "tier": "spine",
      "path": "docs/product/overview.md",
      "record": "documents/product/product_overview.json"
    },
    {
      "id": "flows_index",
      "tier": "spine",
      "path": "docs/flows/README.md",
      "record": "documents/flows_index.json"
    },
    {
      "id": "flow",
      "tier": "diligence",
      "path": "docs/flows/{slug}.md",
      "record": "documents/flow.json"
    },
    {
      "id": "docs_index",
      "tier": "spine",
      "path": "docs/README.md",
      "record": "documents/docs_index.json"
    },
    {
      "id": "root_readme",
      "tier": "spine",
      "path": "README.md",
      "record": "documents/root_readme.json"
    },
    {
      "id": "content_model",
      "tier": "spine",
      "path": "docs/product/content-model.md",
      "record": "documents/product/content_model.json"
    },
    {
      "id": "quickstart",
      "tier": "spine",
      "path": "docs/product/quickstart.md",
      "record": "documents/product/quickstart.json"
    },
    {
      "id": "accessibility",
      "tier": "spine",
      "path": "docs/product/accessibility.md",
      "record": "documents/product/accessibility.json"
    },
    {
      "id": "localization",
      "tier": "spine",
      "path": "docs/product/localization.md",
      "record": "documents/product/localization.json"
    },
    {
      "id": "library_migrations_index",
      "tier": "spine",
      "path": "docs/product/migrations/README.md",
      "record": "documents/product/library_migrations_index.json"
    },
    {
      "id": "api_versioning",
      "tier": "spine",
      "path": "docs/product/versioning.md",
      "record": "documents/product/api_versioning.json"
    },
    {
      "id": "ba_index",
      "tier": "spine",
      "path": "docs/product/business-analyst/README.md",
      "record": "documents/product/ba_index.json"
    },
    {
      "id": "migration",
      "tier": "spine",
      "path": "docs/product/migrations/{slug}.md",
      "record": "documents/product/migration.json"
    },
    {
      "id": "ba_process_flows",
      "tier": "spine",
      "path": "docs/product/business-analyst/process-flows.md",
      "record": "documents/product/ba_process_flows.json"
    },
    {
      "id": "ba_business_rules",
      "tier": "spine",
      "path": "docs/product/business-analyst/business-rules.md",
      "record": "documents/product/ba_business_rules.json"
    },
    {
      "id": "ba_requirements",
      "tier": "spine",
      "path": "docs/product/business-analyst/requirements-traceability.md",
      "record": "documents/product/ba_requirements.json"
    },
    {
      "id": "po_index",
      "tier": "spine",
      "path": "docs/product/product-owner/README.md",
      "record": "documents/product/po_index.json"
    },
    {
      "id": "po_features",
      "tier": "spine",
      "path": "docs/product/product-owner/feature-catalog.md",
      "record": "documents/product/po_features.json"
    },
    {
      "id": "po_metrics",
      "tier": "spine",
      "path": "docs/product/product-owner/success-metrics.md",